<?xml version="1.0" encoding="UTF-8"?>
<xs:schema xmlns:xs="http://www.w3.org/2001/XMLSchema">
  <xs:element name="employees">
    <xs:complexType>
      <xs:sequence>
        <xs:element name="employee" maxOccurs="unbounded">
          <xs:complexType>
            <xs:sequence>
              <xs:element name="id" type="xs:int"/>
              <xs:element name="firstName" type="xs:string"/>
              <xs:element name="lastName" type="xs:string"/>
              <xs:element name="position" type="xs:string"/>
              <xs:element name="department" type="xs:string"/>
              <xs:element name="hireDate" type="xs:date"/>
              <xs:element name="salary" type="xs:int"/>
              <xs:element name="projects">
                <xs:complexType>
                  <xs:sequence>
                    <xs:element name="project" maxOccurs="unbounded">
                      <xs:complexType>
                        <xs:sequence>
                          <xs:element name="name" type="xs:string"/>
                          <xs:element name="startDate" type="xs:date"/>
                          <xs:element name="endDate" type="xs:date"/>
                        </xs:sequence>
                      </xs:complexType>
                    </xs:element>
                  </xs:sequence>
                </xs:complexType>
              </xs:element>
            </xs:sequence>
          </xs:complexType>
        </xs:element>
      </xs:sequence>
    </xs:complexType>
  </xs:element>
</xs:schema>