<?xml version="1.0" encoding="UTF-8"?>
<!-- This sample XML file is provided by Sample-Files.com. Visit us for more sample files and resources. -->
<employees xmlns:xsi="http://www.w3.org/2001/XMLSchema-instance" xsi:noNamespaceSchemaLocation="employees.xsd">
  <employee>
    <id>1</id>
    <firstName>John</firstName>
    <lastName>Doe</lastName>
    <position>Software Engineer</position>
    <department>IT</department>
    <hireDate>2020-01-15</hireDate>
    <salary>75000</salary>
  </employee>
  <employee>
    <id>2</id>
    <firstName>Jane</firstName>
    <lastName>Smith</lastName>
    <position>Project Manager</position>
    <department>Operations</department>
    <hireDate>2019-05-01</hireDate>
    <salary>85000</salary>
  </employee>
  <employee>
    <id>3</id>
    <firstName>Michael</firstName>
    <lastName>Johnson</lastName>
    <position>Data Analyst</position>
    <department>Finance</department>
    <hireDate>2018-03-15</hireDate>
    <salary>65000</salary>
  </employee>
  <employee>
    <id>4</id>
    <firstName>Emily</firstName>
    <lastName>Davis</lastName>
    <position>HR Specialist</position>
    <department>HR</department>
    <hireDate>2017-11-20</hireDate>
    <salary>70000</salary>
  </employee>
  <employee>
    <id>5</id>
    <firstName>David</firstName>
    <lastName>Wilson</lastName>
    <position>Marketing Manager</position>
    <department>Marketing</department>
    <hireDate>2016-07-30</hireDate>
    <salary>90000</salary>
  </employee>
  <employee>
    <id>6</id>
    <firstName>Alice</firstName>
    <lastName>Brown</lastName>
    <position>Accountant</position>
    <department>Finance</department>
    <hireDate>2015-02-10</hireDate>
    <salary>62000</salary>
  </employee>
  <employee>
    <id>7</id>
    <firstName>Robert</firstName>
    <lastName>Jones</lastName>
    <position>Designer</position>
    <department>Marketing</department>
    <hireDate>2018-06-22</hireDate>
    <salary>68000</salary>
  </employee>
  <employee>
    <id>8</id>
    <firstName>Mary</firstName>
    <lastName>Williams</lastName>
    <position>Product Manager</position>
    <department>Product</department>
    <hireDate>2017-09-15</hireDate>
    <salary>85000</salary>
  </employee>
  <employee>
    <id>9</id>
    <firstName>James</firstName>
    <lastName>Garcia</lastName>
    <position>DevOps Engineer</position>
    <department>IT</department>
    <hireDate>2021-04-12</hireDate>
    <salary>78000</salary>
  </employee>
  <employee>
    <id>10</id>
    <firstName>Linda</firstName>
    <lastName>Miller</lastName>
    <position>Customer Support</position>
    <department>Support</department>
    <hireDate>2019-08-25</hireDate>
    <salary>56000</salary>
  </employee>
  <employee>
    <id>11</id>
    <firstName>Daniel</firstName>
    <lastName>Martinez</lastName>
    <position>Sales Manager</position>
    <department>Sales</department>
    <hireDate>2020-11-10</hireDate>
    <salary>91000</salary>
  </employee>
  <employee>
    <id>12</id>
    <firstName>Patricia</firstName>
    <lastName>Rodriguez</lastName>
    <position>UX Designer</position>
    <department>Design</department>
    <hireDate>2018-02-18</hireDate>
    <salary>74000</salary>
  </employee>
  <employee>
    <id>13</id>
    <firstName>Charles</firstName>
    <lastName>Martinez</lastName>
    <position>Business Analyst</position>
    <department>Business</department>
    <hireDate>2019-03-30</hireDate>
    <salary>67000</salary>
  </employee>
  <employee>
    <id>14</id>
    <firstName>Susan</firstName>
    <lastName>Lopez</lastName>
    <position>HR Manager</position>
    <department>HR</department>
    <hireDate>2016-05-21</hireDate>
    <salary>80000</salary>
  </employee>
  <employee>
    <id>15</id>
    <firstName>Christopher</firstName>
    <lastName>Wilson</lastName>
    <position>Network Engineer</position>
    <department>IT</department>
    <hireDate>2017-12-05</hireDate>
    <salary>73000</salary>
  </employee>
  <employee>
    <id>16</id>
    <firstName>Jessica</firstName>
    <lastName>White</lastName>
    <position>Legal Advisor</position>
    <department>Legal</department>
    <hireDate>2015-11-13</hireDate>
    <salary>90000</salary>
  </employee>
  <employee>
    <id>17</id>
    <firstName>Matthew</firstName>
    <lastName>Clark</lastName>
    <position>Consultant</position>
    <department>Consulting</department>
    <hireDate>2018-08-29</hireDate>
    <salary>85000</salary>
  </employee>
  <employee>
    <id>18</id>
    <firstName>Amanda</firstName>
    <lastName>Harris</lastName>
    <position>Content Writer</position>
    <department>Content</department>
    <hireDate>2020-07-14</hireDate>
    <salary>58000</salary>
  </employee>
  <employee>
    <id>19</id>
    <firstName>Brian</firstName>
    <lastName>Martinez</lastName>
    <position>SEO Specialist</position>
    <department>Marketing</department>
    <hireDate>2019-09-25</hireDate>
    <salary>66000</salary>
  </employee>
  <employee>
    <id>20</id>
    <firstName>Rebecca</firstName>
    <lastName>King</lastName>
    <position>Office Manager</position>
    <department>Administration</department>
    <hireDate>2017-04-17</hireDate>
    <salary>62000</salary>
  </employee>
</employees>